{
  "$schema": "https://json-schema.org/draft/2020-12/schema",
  "$id": "urn:voku:php-runtime-audit:evidence:v1:coverage",
  "title": "PHP Runtime Audit Coverage v1",
  "type": "object",
  "additionalProperties": false,
  "required": ["record_type", "schema_version", "record_id", "recorded_at", "entries"],
  "properties": {
    "record_type": {"const": "coverage"},
    "schema_version": {"const": "1.0"},
    "record_id": {"$ref": "#/$defs/id"},
    "recorded_at": {"$ref": "#/$defs/timestamp"},
    "entries": {"type": "array", "minItems": 1, "maxItems": 2048, "items": {"$ref": "#/$defs/entry"}}
  },
  "$defs": {
    "id": {"type": "string", "minLength": 1, "maxLength": 128, "pattern": "^[A-Za-z0-9][A-Za-z0-9._:-]*$"},
    "timestamp": {"type": "string", "maxLength": 40, "pattern": "^[0-9]{4}-[0-9]{2}-[0-9]{2}T[0-9]{2}:[0-9]{2}:[0-9]{2}(\\.[0-9]{1,6})?(Z|[+-][0-9]{2}:[0-9]{2})$", "format": "date-time"},
    "evidence_ids": {"type": "array", "maxItems": 512, "uniqueItems": true, "items": {"$ref": "#/$defs/id"}},
    "entry": {
      "type": "object",
      "additionalProperties": false,
      "required": ["subject_id", "check_id", "status", "evidence_ids", "gap"],
      "properties": {
        "subject_id": {"$ref": "#/$defs/id"},
        "check_id": {"$ref": "#/$defs/id"},
        "status": {"enum": ["attempted", "skipped", "blocked"]},
        "evidence_ids": {"$ref": "#/$defs/evidence_ids"},
        "gap": {"oneOf": [{"type": "null"}, {"type": "string", "minLength": 1, "maxLength": 1000}]}
      },
      "allOf": [
        {
          "if": {"properties": {"status": {"enum": ["skipped", "blocked"]}}, "required": ["status"]},
          "then": {"properties": {"gap": {"type": "string", "minLength": 1}}
          }
        },
        {
          "if": {"properties": {"status": {"const": "attempted"}, "evidence_ids": {"maxItems": 0}}, "required": ["status", "evidence_ids"]},
          "then": {"properties": {"gap": {"type": "string", "minLength": 1}}
          }
        }
      ]
    }
  }
}
